{
  "id": "nextjs",
  "display": "Next.js (TypeScript)",
  "description": "Full-stack React apps with Next.js (App Router or Pages Router)",
  "detect": ["next.config.js", "next.config.ts", "next.config.mjs"],
  "skills": ["nextjs-dev"],
  "mcp_servers": [
    {
      "name": "context7",
      "install_cmd": "Add to ~/.cursor/mcp.json and ~/.claude/settings.json — see docs/MCP_SETUP.md",
      "purpose": "Library docs on demand (saves tokens vs full doc reads)",
      "required": false
    },
    {
      "name": "gitnexus",
      "install_cmd": "Install gitnexus CLI; add mcp server — see docs/MCP_SETUP.md",
      "purpose": "Code graph navigation (saves tokens vs broad grep)",
      "required": false
    }
  ],
  "agent_overrides": {},
  "test_cmd": "bash scripts/rtk-node.sh test",
  "lint_cmd": "bash scripts/rtk-node.sh lint",
  "run_cmd": "npm run dev",
  "stack_doc": "docs/NEXTJS_STACK.md",
  "token_budget_extra": 2500
}
